<?xml version="1.0" encoding="UTF-8"?>
<xs:schema xmlns:xs="http://www.w3.org/2001/XMLSchema"
	targetNamespace="http://www.w3schools.com"
	xmlns="http://www.w3schools.com"
	elementFormDefault="qualified">
	<xs:element name="types">
		<xs:complexType>
			<xs:sequence>
				<xs:element name="type" type="issuetype" maxOccurs="unbounded"/>
			</xs:sequence>
		</xs:complexType>
	</xs:element>
	
	<xs:complexType name="issuetype">
		<xs:sequence>
			<xs:element name="id" type="xs:integer"/>
			<xs:element name="name" type="xs:string"/>
		</xs:sequence>
	</xs:complexType>
</xs:schema>